<!DOCTYPE Products SYSTEM 'Schema.dtd'/>
<listProducts>
 <product id="123">
  <type brand="Apple" typeId="AAAA"/>
  <model gen="Early 2018" modelId="1"/>
  <type misc="xxx" dummy="morgens"/>
  <type amount="9000" currency="EURO"/>
 </product>
 <product id="678">
  <type brand="Samsung" typeId="HHHH"/>
  <model gen="Late 2017" modelId="22"/>
  <type misc="yyy" dummy="mittags"/>
  <type amount="4000" currency="EURO"/>
 </product>
 <product id="564">
  <type brand="Honor" typeId="ZZZZ"/>
  <model gen="Early 2050" modelId="57"/>
  <type misc="zzz" dummy="abends"/>
  <type amount="200" currency="DOLLAR"/>
 </product>
 <product id="&quot;123&quot;">
  <type brand="&quot;NIKE&quot;" typeId="&quot;TTTT&quot;"/>
  <model gen="&quot;Early 2018&quot;" modelId="&quot;100&quot;"/>
  <type misc="&quot;xxx&quot;" dummy="&quot;morgens&quot;"/>
  <type amount="&quot;90000&quot;" currency="&quot;YEN&quot;&#xd;&#xa;"/>
 </product>
 <product id="&quot;678&quot;">
  <type brand="&quot;ADIDAS&quot;" typeId="&quot;GGGG&quot;"/>
  <model gen="&quot;Late 2017&quot;" modelId="&quot;220&quot;"/>
  <type misc="&quot;yyy&quot;" dummy="&quot;mittags&quot;"/>
  <type amount="&quot;40000&quot;" currency="&quot;YEN&quot;&#xd;&#xa;"/>
 </product>
</listProducts>
